{
  "$schema": "https://json-schema.org/draft/2020-12/schema",
  "$id": "https://animundo-builder/contracts/draft.schema.json",
  "title": "A family's draft of one place",
  "type": "object",
  "additionalProperties": false,
  "required": [
    "kind",
    "owner_uid",
    "family_uids",
    "status"
  ],
  "properties": {
    "kind": {
      "enum": [
        "new_place",
        "animal_home"
      ]
    },
    "area_id": {
      "type": "string",
      "minLength": 1
    },
    "owner_uid": {
      "type": "string",
      "minLength": 1
    },
    "family_uids": {
      "type": "array",
      "minItems": 1,
      "items": {
        "type": "string"
      }
    },
    "first_explorer_species": {
      "type": "string",
      "minLength": 1
    },
    "status": {
      "enum": [
        "requested",
        "queued",
        "building",
        "ready",
        "improving",
        "in_review",
        "public",
        "not_accepted",
        "expired",
        "not_possible_yet",
        "failed"
      ]
    },
    "stage": {
      "enum": [
        "land",
        "animals",
        "models",
        "checking",
        "packing"
      ]
    },
    "stage_detail": {
      "type": "string"
    },
    "place_name": {
      "type": "string"
    },
    "country": {
      "type": "string",
      "pattern": "^[A-Z]{2}$"
    },
    "center": {
      "type": "object",
      "additionalProperties": false,
      "required": [
        "lat",
        "lon"
      ],
      "properties": {
        "lat": {
          "type": "number"
        },
        "lon": {
          "type": "number"
        }
      }
    },
    "draft_place_id": {
      "type": "string",
      "pattern": "^(draft_|[a-z]+_[a-z0-9_]+$)"
    },
    "place_id": {
      "type": "string",
      "minLength": 1
    },
    "candidates": {
      "type": "array",
      "items": {
        "type": "object",
        "additionalProperties": false,
        "required": [
          "species",
          "role",
          "source"
        ],
        "properties": {
          "species": {
            "type": "string"
          },
          "role": {
            "enum": [
              "playable",
              "predator",
              "prey"
            ]
          },
          "source": {
            "type": "string"
          }
        }
      }
    },
    "round": {
      "type": "integer",
      "minimum": 1
    },
    "pack_version": {
      "type": "integer",
      "minimum": 0
    },
    "improve": {
      "type": "object",
      "additionalProperties": false,
      "required": [
        "choices",
        "at"
      ],
      "properties": {
        "choices": {
          "type": "array",
          "minItems": 1,
          "items": {
            "type": "object",
            "additionalProperties": false,
            "required": [
              "choice"
            ],
            "properties": {
              "choice": {
                "enum": [
                  "animal_looks_wrong",
                  "colours_off",
                  "too_few_animals",
                  "other"
                ]
              },
              "species": {
                "type": "string"
              }
            }
          }
        },
        "note": {
          "type": "string",
          "maxLength": 200
        },
        "at": {
          "type": "string"
        }
      }
    },
    "submit": {
      "type": "object",
      "additionalProperties": false,
      "required": [
        "at"
      ],
      "properties": {
        "at": {
          "type": "string"
        }
      }
    },
    "last_played_at": {
      "type": "string"
    },
    "expires_at": {
      "type": "string"
    },
    "pr_url": {
      "type": "string"
    },
    "review_result": {
      "type": "object",
      "additionalProperties": false,
      "required": [
        "result",
        "reason"
      ],
      "properties": {
        "result": {
          "enum": [
            "accepted",
            "not_accepted"
          ]
        },
        "reason": {
          "type": "string"
        }
      }
    },
    "pack_superseded_at": {
      "type": "string"
    },
    "admin_answer": {
      "type": "string",
      "maxLength": 300
    },
    "created_at": {
      "type": "string"
    },
    "updated_at": {
      "type": "string"
    },
    "error": {
      "type": "string"
    },
    "species_key": {
      "type": "integer",
      "minimum": 1
    },
    "place": {
      "type": "object",
      "additionalProperties": false,
      "required": [
        "wikidata_id",
        "name",
        "fi",
        "kind",
        "country"
      ],
      "properties": {
        "wikidata_id": {
          "type": "string",
          "pattern": "^Q[0-9]+$"
        },
        "name": {
          "type": "string",
          "minLength": 1
        },
        "fi": {
          "type": ["string", "null"]
        },
        "kind": {
          "type": "string",
          "minLength": 1
        },
        "country": {
          "type": ["string", "null"],
          "maxLength": 2
        }
      }
    },
    "country_name": {
      "type": "string",
      "maxLength": 60
    },
    "cost_usd": {
      "type": "number",
      "minimum": 0
    }
  }
}
