{
  "kind": "new_place",
  "area_id": "gb_cairngorms",
  "owner_uid": "owner-uid-1",
  "family_uids": ["owner-uid-1"],
  "first_explorer_species": "mountain_hare",
  "status": "ready",
  "stage": "packing",
  "place_name": "Cairngorms",
  "country": "GB",
  "center": {"lat": 57.07, "lon": -3.67},
  "draft_place_id": "draft_k3x9q2",
  "place_id": "gb_cairngorms",
  "candidates": [
    {"species": "red_deer", "role": "playable", "source": "https://example.org/deer"}
  ],
  "round": 1,
  "pack_version": 1,
  "created_at": "2026-11-01T10:00:00+02:00",
  "updated_at": "2026-11-01T10:20:00+02:00"
}
